{
  "policy_version": "1.1",
  "maturity_levels": {
    "0": [],
    "1": ["definition"],
    "2": ["prototype"],
    "3": ["passing_test"],
    "4": ["canonical_integration", "dogfood_run"],
    "5": ["clean_reproduction"],
    "6": ["external_validation"]
  },
  "stage_profiles": {
    "alpha": {
      "module_requirements": [
        {"selector": {"layer": ["L0", "L1", "L2"], "critical": true}, "min_maturity": 4},
        {"module_id": "orchestration.single_agent", "min_maturity": 4},
        {"module_id": "evaluation.acceptance", "min_maturity": 4},
        {"module_id": "ux.clean_install", "min_maturity": 5},
        {"module_id": "oss.license_security_contributing", "min_maturity": 4}
      ],
      "mandatory_gates": ["G0", "G1", "G2", "G3", "G4"],
      "advisory_gates": ["G5"]
    },
    "beta": {
      "module_requirements": [
        {"selector": {"critical": true}, "min_maturity": 5},
        {"module_id": "orchestration.multi_agent", "min_maturity": 5},
        {"module_id": "recovery.resume", "min_maturity": 5},
        {"module_id": "ux.clean_install", "min_maturity": 6}
      ],
      "mandatory_gates": ["G0", "G1", "G2", "G3", "G4", "G5"],
      "advisory_gates": []
    },
    "1.0": {
      "module_requirements": [
        {"selector": {"critical": true}, "min_maturity": 6}
      ],
      "mandatory_gates": ["G0", "G1", "G2", "G3", "G4", "G5"],
      "advisory_gates": []
    }
  },
  "gates": [
    {
      "gate_id": "G0",
      "mandatory": true,
      "required_checks": [
        {
          "check_id": "G0.license_clean",
          "dimension": "security_privacy_ip",
          "critical": true,
          "allow_na": false,
          "required_roles": ["judge.security-privacy-ip-a", "judge.security-privacy-ip-b"],
          "allowed_roles": ["judge.security-privacy-ip-a", "judge.security-privacy-ip-b"]
        },
        {
          "check_id": "G0.third_party_provenance",
          "dimension": "security_privacy_ip",
          "critical": true,
          "allow_na": false,
          "required_roles": ["judge.security-privacy-ip-a", "judge.security-privacy-ip-b"],
          "allowed_roles": ["judge.security-privacy-ip-a", "judge.security-privacy-ip-b"]
        },
        {
          "check_id": "G0.secrets_privacy",
          "dimension": "security_privacy_ip",
          "critical": true,
          "allow_na": false,
          "required_roles": ["judge.security-privacy-ip-a", "judge.security-privacy-ip-b"],
          "allowed_roles": ["judge.security-privacy-ip-a", "judge.security-privacy-ip-b"]
        },
        {
          "check_id": "G0.threat_model",
          "dimension": "adversarial_meta",
          "critical": true,
          "allow_na": false,
          "required_roles": ["judge.adversarial-meta-a", "judge.adversarial-meta-b"],
          "allowed_roles": ["judge.adversarial-meta-a", "judge.adversarial-meta-b"]
        }
      ],
      "required_roles": [
        {"role_id": "judge.security-privacy-ip-a", "min_count": 1},
        {"role_id": "judge.security-privacy-ip-b", "min_count": 1},
        {"role_id": "judge.adversarial-meta-a", "min_count": 1},
        {"role_id": "judge.adversarial-meta-b", "min_count": 1}
      ]
    },
    {
      "gate_id": "G1",
      "mandatory": true,
      "required_checks": [
        {
          "check_id": "G1.clean_install",
          "dimension": "install_dx",
          "critical": true,
          "allow_na": false,
          "required_roles": ["judge.install-dx-a", "judge.install-dx-b"],
          "allowed_roles": ["judge.install-dx-a", "judge.install-dx-b"]
        },
        {
          "check_id": "G1.canonical_e2e",
          "dimension": "install_dx",
          "critical": true,
          "allow_na": false,
          "required_roles": ["judge.install-dx-a", "judge.install-dx-b"],
          "allowed_roles": ["judge.install-dx-a", "judge.install-dx-b"]
        },
        {
          "check_id": "G1.outcome_state",
          "dimension": "professional_value",
          "critical": true,
          "allow_na": false,
          "required_roles": ["judge.professional-value-a", "judge.professional-value-b"],
          "allowed_roles": ["judge.professional-value-a", "judge.professional-value-b"]
        }
      ],
      "required_roles": [
        {"role_id": "judge.install-dx-a", "min_count": 1},
        {"role_id": "judge.install-dx-b", "min_count": 1},
        {"role_id": "judge.professional-value-a", "min_count": 1},
        {"role_id": "judge.professional-value-b", "min_count": 1}
      ]
    },
    {
      "gate_id": "G2",
      "mandatory": true,
      "required_checks": [
        {
          "check_id": "G2.isolation_permission",
          "dimension": "architecture",
          "critical": true,
          "allow_na": false,
          "required_roles": ["judge.architecture-a", "judge.architecture-b"],
          "allowed_roles": ["judge.architecture-a", "judge.architecture-b"]
        },
        {
          "check_id": "G2.cancel_timeout",
          "dimension": "reliability_recovery",
          "critical": true,
          "allow_na": false,
          "required_roles": ["judge.reliability-recovery-a", "judge.reliability-recovery-b"],
          "allowed_roles": ["judge.reliability-recovery-a", "judge.reliability-recovery-b"]
        },
        {
          "check_id": "G2.retry_idempotency",
          "dimension": "reliability_recovery",
          "critical": true,
          "allow_na": false,
          "required_roles": ["judge.reliability-recovery-a", "judge.reliability-recovery-b"],
          "allowed_roles": ["judge.reliability-recovery-a", "judge.reliability-recovery-b"]
        },
        {
          "check_id": "G2.resume_recovery",
          "dimension": "reliability_recovery",
          "critical": true,
          "allow_na": false,
          "required_roles": ["judge.reliability-recovery-a", "judge.reliability-recovery-b"],
          "allowed_roles": ["judge.reliability-recovery-a", "judge.reliability-recovery-b"]
        },
        {
          "check_id": "G2.audit_provenance",
          "dimension": "architecture",
          "critical": true,
          "allow_na": false,
          "required_roles": ["judge.architecture-a", "judge.architecture-b"],
          "allowed_roles": ["judge.architecture-a", "judge.architecture-b"]
        }
      ],
      "required_roles": [
        {"role_id": "judge.reliability-recovery-a", "min_count": 1},
        {"role_id": "judge.reliability-recovery-b", "min_count": 1},
        {"role_id": "judge.architecture-a", "min_count": 1},
        {"role_id": "judge.architecture-b", "min_count": 1}
      ]
    },
    {
      "gate_id": "G3",
      "mandatory": true,
      "required_checks": [
        {
          "check_id": "G3.versioned_eval",
          "dimension": "benchmark",
          "critical": true,
          "allow_na": false,
          "required_roles": ["judge.benchmark-a", "judge.benchmark-b"],
          "allowed_roles": ["judge.benchmark-a", "judge.benchmark-b"]
        },
        {
          "check_id": "G3.baseline_raw_trials",
          "dimension": "benchmark",
          "critical": true,
          "allow_na": false,
          "required_roles": ["judge.benchmark-a", "judge.benchmark-b"],
          "allowed_roles": ["judge.benchmark-a", "judge.benchmark-b"]
        },
        {
          "check_id": "G3.negative_cases",
          "dimension": "adversarial_meta",
          "critical": true,
          "allow_na": false,
          "required_roles": ["judge.adversarial-meta-a", "judge.adversarial-meta-b"],
          "allowed_roles": ["judge.adversarial-meta-a", "judge.adversarial-meta-b"]
        },
        {
          "check_id": "G3.reproducibility",
          "dimension": "benchmark",
          "critical": true,
          "allow_na": false,
          "required_roles": ["judge.benchmark-a", "judge.benchmark-b"],
          "allowed_roles": ["judge.benchmark-a", "judge.benchmark-b"]
        },
        {
          "check_id": "G3.mechanism_coverage",
          "dimension": "mechanism_coverage",
          "critical": true,
          "allow_na": false,
          "required_roles": ["judge.mechanism-coverage-a", "judge.mechanism-coverage-b"],
          "allowed_roles": ["judge.mechanism-coverage-a", "judge.mechanism-coverage-b"]
        },
        {
          "check_id": "G3.truth_claims",
          "dimension": "truth_claim",
          "critical": true,
          "allow_na": false,
          "required_roles": ["judge.truth-claim-a", "judge.truth-claim-b"],
          "allowed_roles": ["judge.truth-claim-a", "judge.truth-claim-b"]
        }
      ],
      "required_roles": [
        {"role_id": "judge.benchmark-a", "min_count": 1},
        {"role_id": "judge.benchmark-b", "min_count": 1},
        {"role_id": "judge.mechanism-coverage-a", "min_count": 1},
        {"role_id": "judge.mechanism-coverage-b", "min_count": 1},
        {"role_id": "judge.truth-claim-a", "min_count": 1},
        {"role_id": "judge.truth-claim-b", "min_count": 1},
        {"role_id": "judge.adversarial-meta-a", "min_count": 1},
        {"role_id": "judge.adversarial-meta-b", "min_count": 1}
      ]
    },
    {
      "gate_id": "G4",
      "mandatory": true,
      "required_checks": [
        {
          "check_id": "G4.quickstart_architecture",
          "dimension": "architecture",
          "critical": true,
          "allow_na": false,
          "required_roles": ["judge.architecture-a", "judge.architecture-b"],
          "allowed_roles": ["judge.architecture-a", "judge.architecture-b"]
        },
        {
          "check_id": "G4.upgrade_rollback",
          "dimension": "architecture",
          "critical": true,
          "allow_na": false,
          "required_roles": ["judge.architecture-a", "judge.architecture-b"],
          "allowed_roles": ["judge.architecture-a", "judge.architecture-b"]
        },
        {
          "check_id": "G4.security_contributing",
          "dimension": "oss_community",